{
  "version": "2.0",
  "tenant_id": "core",
  "environment": "lab",
  "created_at": "2025-12-31T15:51:02.165163Z",
  "intention": {
    "universes": [
      "odoo"
    ],
    "mode": "saas",
    "domains": {
      "canonical": "doreviateam.com",
      "aliases": []
    },
    "preflight": {
      "enabled": true,
      "install_controlled": false
    }
  },
  "created_by": "dorevia@doreviateam.com"
}